{
  "$schema": "../schema/scanner-subject-taxonomy.schema.json",
  "version": 2,
  "subjectClass": {
    "key": "scanner_run",
    "name": "The scanner run",
    "definition": "One execution of an instrument that produces a judgement: a scanner lane over a repository, a gate over a tree, an agent session over a working tree, a rater over a finding. The subject is the RUN and its record, never the repository the run examined.",
    "contrast": "monitor/failure-taxonomy.json holds 166 classes whose subject is a repository under scan. The scanner, agent and oversight loops appear there as CONTROLLERS. This registry transposes the axis: those same loops become the SUBJECT, and the question changes from 'what did the run get wrong about the repository' to 'what can go wrong about the run itself, and who would see it'.",
    "whatChanges": [
      "The subject writes its own evidence. A repository does not narrate its own scan; a run does.",
      "The subject and the instrument share a substrate. A scanned repository is a separate tree; a run edits the tree its overseer reads.",
      "The subject is plural and concurrent. One repository is scanned once per slice; several runs act on one tree at once, and their independence is assumed rather than measured.",
      "A finding is about a measurement rather than about code. Its truth condition is another measurement, so the regress has to terminate somewhere a human named."
    ],
    "boundary": "OUT OF SCOPE, and deliberately: alignment, incentives, model psychology, safety culture, and any claim about intent. This registry classifies only what an oversight layer can OBSERVE and RECORD about a run. Every class here is falsifiable by an instrument that could be built. A class that requires reading a subject's motives does not belong in it."
  },
  "generatedFrom": [
    "monitor/failure-taxonomy.json (v8, 166 classes) — the parent registry, read for its stpa vocabulary and for citation resolution",
    "an external incident report on an agent deployment, mapped to this repository's instruments by measurement rather than by reading",
    "measured instrument states in this tree at 2026-08-30"
  ],
  "parentRegistry": "monitor/failure-taxonomy.json",
  "referenceSets": [
    {
      "name": "landed",
      "path": "monitor/failure-taxonomy.json",
      "pick": "classes",
      "note": "the parent registry's landed classes"
    },
    {
      "name": "proposed",
      "path": "$CW_SIDECAR/documents/tools/proposed.json",
      "pick": "array",
      "note": "proposed additions to the PARENT taxonomy, held in the sidecar. $CW_SIDECAR is expanded at read time: the env var wins, and with it unset the sidecar beside the checkout is the default. A machine that has neither renders the comparison as unmeasured naming the missing input, and a sidecar whose file is ENOENT as unmeasured too — never as zero distance."
    }
  ],
  "verifiedAgainst": "2026-08-30 (parent registry v9, 173 classes)",
  "note": "A new subject class, not a new opinion about the old one. Every class declares whether it is inherited (an existing parent class that applies verbatim once the subject changes), transposed (an existing class whose meaning changes under the new subject) or novel (no cell in the parent registry), and every cited parent id is resolved against the parent at render time so a citation cannot rot. The hand-assigned origin is then cross-checked by lib/taxonomy-distance.mjs against a measured nearest-neighbour distance, using each reference set's OWN internal median as the threshold. Disagreement between the label and the measurement is the finding, not an error to be reconciled away. This registry’s ledger family is prefixed J because the parent’s family XI (Collective action) holds L, and three classes cite into that family. Resolving citations at render time is what catches a parent change like that without anyone re-reading the parent.",
  "analogyStyle": "mcp__style__ prose corpus: one declarative sentence, present tense, concrete actor, no em-dash, no emphatic particles, no closing moral.",
  "scoreProvenance": "closure and gain assigned by a single rater, who authored both the classes and the instrument-state readings that inform them. No inter-rater pass. Treat these as one reading, not a measurement. The instrumentState field is NOT a score: it is measured by import and spawn count in this tree at the stamp above, and is re-derivable.",
  "scales": {
    "closure": "0 = nothing stands between us and this class; 4 = fixed and pinned by a test or canary",
    "gain": "0 = nothing further on the table; 4 = the largest remaining win, impact x tractability"
  },
  "scaleBounds": {
    "closureMin": 0,
    "closureMax": 4,
    "gainMin": 0,
    "gainMax": 4,
    "fullyClosed": 4
  },
  "fullClosureAbsent": "No class in this registry reaches closure 4, and that is the registry's headline reading rather than an oversight. Closure 4 means fixed and PINNED by a test or a canary. Nothing in this tree takes a scanner run as a subject, so no test asserts anything about one; the highest closures here (3) are instruments that answer a class incidentally, while doing a different job. A consumer must therefore NOT gate on full closure against this registry: it would pass vacuously, which is the defect the parent registry records four times. This field is required by the schema precisely so the absence has to be declared rather than discovered.",
  "origins": {
    "inherited": {
      "test": "The parent class applies verbatim once the subject is a run. It is restated here only because it is load-bearing for this subject class and a reader of this registry alone would otherwise miss it.",
      "requiresInherits": true
    },
    "transposed": {
      "test": "A parent class exists and its MEANING changes when the subject becomes a run. The originNote must say what changes; without that it is a duplicate wearing a new id.",
      "requiresInherits": true
    },
    "novel": {
      "test": "No cell in the parent registry covers this. inherits must be empty, and the measured distance is the second witness on that claim.",
      "requiresInherits": false
    }
  },
  "instrumentStates": {
    "wired": {
      "test": "The module is imported or spawned on a path that runs without a human choosing to run it (a sweep, a gate, a hook)."
    },
    "partial": {
      "test": "The module runs, on a narrower population than the class covers, or answers part of the class only."
    },
    "orphaned": {
      "test": "The module exists in the tree and nothing imports or spawns it: no importer outside its own tests, and no CLI entry point. It is code, not coverage."
    },
    "absent": {
      "test": "No module in the tree addresses this class. instrument is null."
    }
  },
  "lensNote": "The security lenses this project already reads a system through. `layer` (IMPL/CTRL/BOTH) is inherited from the parent registry and answers WHO the defect belongs to; `lens` answers WHICH STANDING DISCIPLINE would catch it, and is the axis a reader uses to decide what to build. Bands group lenses by what they defend: a record, a reading, or a judgement. Seven of these are marked named:true (hash-chaining, determinism, ledgers, correlation, authority-separation as HITL remediation, scoring-modes, error-rates); the other seven were measured out of this tree and are marked found:true.",
  "lensBands": {
    "record-integrity": "Defends what was written: that it is still there, still linked, and still means what it meant.",
    "reading-discipline": "Defends what a value is allowed to mean: absence, sameness, time, and reproducibility.",
    "judgement-authority": "Defends how a verdict is formed and who is entitled to close it."
  },
  "lenses": {
    "hash-chaining": {
      "band": "record-integrity",
      "named": true,
      "test": "Would a link from each record to its predecessor make this visible, and does a break separate a rewrite from a race?",
      "instruments": [
        "bin/verdict-journal.mjs",
        "bin/lib/ledger-rotate.mjs"
      ],
      "state": "Applied to .claude/verdicts only. journalHealth is rotation-aware and separates interior edits from concurrent races."
    },
    "ledgers": {
      "band": "record-integrity",
      "named": true,
      "test": "Is the act recorded at all, append-only, with the fields a later reader will actually need?",
      "instruments": [
        "bin/lib/touch-ledger-core.mjs",
        "bin/spine-ledger.mjs",
        "bin/lib/ledger-rotate.mjs"
      ],
      "state": "Six or more append-only stores under .claude/store and .claude/verdicts. touches.jsonl records a path without recording direction."
    },
    "second-witness": {
      "band": "record-integrity",
      "named": false,
      "found": true,
      "test": "Is there a second observer that CANNOT share the first one's failure mode, and is its disagreement asserted in both directions?",
      "instruments": [
        "lib/offbox-evidence.mjs",
        "lib/memory-layer-client.mjs",
        "monitor/lane-capability.mjs"
      ],
      "state": "The house rule states it explicitly: a guard needs a second witness that cannot share its failure mode. lib/offbox-evidence.mjs restricts vantages to a declared set and fails closed to UNVERIFIABLE; it has one importer."
    },
    "change-set-closure": {
      "band": "record-integrity",
      "named": false,
      "found": true,
      "test": "Is the claim closed over the change set it ships in, judged against HEAD rather than against the author's working tree?",
      "instruments": [
        "bin/test/tracked-imports.test.mjs"
      ],
      "state": "Enforced. The guard reads HEAD, never the working tree, and fails on a dangling specifier or a named import the target does not export."
    },
    "absence-semantics": {
      "band": "reading-discipline",
      "named": false,
      "found": true,